{
  "$schema": "http://json-schema.org/draft-07/schema#",
  "title": "Booking",
  "description": "Schema for a single booking response from GET /booking/:id",
  "type": "object",
  "required": ["firstname", "lastname", "totalprice", "depositpaid", "bookingdates"],
  "properties": {
    "firstname": {
      "type": "string",
      "minLength": 1
    },
    "lastname": {
      "type": "string",
      "minLength": 1
    },
    "totalprice": {
      "type": "integer"
    },
    "depositpaid": {
      "type": "boolean"
    },
    "bookingdates": {
      "type": "object",
      "required": ["checkin", "checkout"],
      "properties": {
        "checkin": {
          "type": "string"
        },
        "checkout": {
          "type": "string"
        }
      },
      "additionalProperties": false
    },
    "additionalneeds": {
      "type": "string"
    }
  }
}
